{
  "schema_version": "score-snapshot.v1",
  "score_snapshot_id": "scores-001",
  "request_id": "rank-001",
  "request_sha256": "6666666666666666666666666666666666666666666666666666666666666666",
  "model_id": "cooccurrence-v1-fixture",
  "dataset_id": "commander-completion-v1-fixture",
  "feature_spec_version": "card-features-v1",
  "ruleset_version": "commander-2026-02-09",
  "card_snapshot_id": "cards-2026-08-10",
  "candidate_pool_hash": "2222222222222222222222222222222222222222222222222222222222222222",
  "scores": [
    {
      "oracle_id": "44444444-4444-4444-8444-444444444444",
      "final_score": 0.82,
      "components": [
        {
          "name": "commander_lift",
          "raw_value": 1.4,
          "normalized_value": 0.8,
          "weight": 0.7,
          "contribution": 0.56
        },
        {
          "name": "deck_cooccurrence",
          "raw_value": 0.9,
          "normalized_value": 0.65,
          "weight": 0.4,
          "contribution": 0.26
        }
      ],
      "uncertainty": 0.12,
      "legal": true,
      "warning_codes": []
    }
  ],
  "created_at": "2026-08-10T18:01:00Z",
  "sha256": "7777777777777777777777777777777777777777777777777777777777777777"
}
